{
  "$schema": "../../../references/operation-template.schema.json",
  "operation_id": "execution_recovery.classify-earliest-failure",
  "template_version": "0.1.0",
  "contract_version": 1,
  "status": "candidate",
  "stage": "execution_recovery",
  "purpose": "Assign an evidence-backed category to one captured earliest failure without guessing a repair.",
  "trigger": "Use after EX-12 has produced an ordered earliest_failure record.",
  "inputs": [
    {
      "name": "earliest_failure",
      "type": "object",
      "description": "Captured first error, stage, source location, run reference, and observed state.",
      "required": true
    },
    {
      "name": "error_category_definitions",
      "type": "array",
      "description": "Versioned category definitions and evidence predicates.",
      "required": true
    }
  ],
  "preconditions": [
    "earliest_failure has original error text and first stage.",
    "Category definitions are versioned and available."
  ],
  "outputs": [
    {
      "name": "failure_classification",
      "type": "object",
      "description": "One category, supporting fields, confidence, and unresolved items.",
      "required": true
    },
    {
      "name": "needs_manual_review",
      "type": "boolean",
      "description": "True when evidence does not distinguish one category.",
      "required": true
    }
  ],
  "postconditions": [
    "Exactly one category is returned only when its predicate is satisfied.",
    "Ambiguous evidence yields needs_manual_review and no repair prescription."
  ],
  "implementation": {
    "mode": "reasoning_guidance",
    "primary_artifact": "spaceclaim-vision-modeling/references/atomic-guidance/er-01.json",
    "target_environment": "SpaceClaim V21-compatible contract reasoning; no host execution is performed by this operation.",
    "topology_effect": "none",
    "determinism": "deterministic",
    "notes": "The reusable artifact is this candidate guidance contract; no executable implementation is claimed. Classification gate only; no category-specific repair execution is claimed."
  },
  "semantic_selection": {
    "required": false,
    "criteria": [],
    "ambiguity_checks": [
      "Use only the declared identity, state, or geometry predicates; do not substitute recorded FaceN/BodyN aliases or an arbitrary collection member.",
      "If the declared evidence cannot make the target unique, return needs_manual_review and do not continue."
    ],
    "topology_refresh": "Not applicable; the operation does not mutate model topology."
  },
  "failure_modes": [
    {
      "failure_id": "category_ambiguous",
      "condition": "Evidence supports multiple categories or none.",
      "detection": "Predicates tie or no predicate matches.",
      "safe_state": "No repair is authorized."
    },
    {
      "failure_id": "category_overreach",
      "condition": "A repair is included in classification output.",
      "detection": "Result contains an unsupported patch/call.",
      "safe_state": "Discard repair payload; retain classification only."
    }
  ],
  "recovery": [
    {
      "failure_id": "category_ambiguous",
      "action": "Return needs_manual_review and request the missing discriminator.",
      "clean_rerun_required": false
    },
    {
      "failure_id": "category_overreach",
      "action": "Re-run with repair fields excluded; select ER-02..ER-10 separately.",
      "clean_rerun_required": false
    }
  ],
  "validation": [
    {
      "check": "Candidate identity and schema shape",
      "method": "Validate this object against operation-template.schema.json and compare operation_id with the EX/ER catalog slug.",
      "expected": "The object is schema-valid, remains candidate, and declares exactly one bounded execution_recovery action.",
      "evidence_layer": "design_only"
    },
    {
      "check": "Guidance binding and refusal boundary",
      "method": "Read the linked single-operation guidance and compare its input, result, procedure, and rejection fields with this contract.",
      "expected": "The contract exposes every declared input/output and preserves refusal, recovery, and needs_manual_review behavior.",
      "evidence_layer": "design_only"
    },
    {
      "check": "Action-specific postcondition",
      "method": "Use the operation-specific controller or host-tool adapter only after the required authorization and target-state gates are independently satisfied.",
      "expected": "Exactly one category is returned only when its predicate is satisfied.",
      "evidence_layer": "design_only"
    }
  ],
  "dependencies": [
    "execution_recovery.capture-earliest-failure-state"
  ],
  "evidence_level": {
    "template_version": "0.1.0",
    "layers": {
      "design_only": {
        "status": "passed",
        "evidence_refs": [
          {
            "path": "spaceclaim-vision-modeling/assets/operation-templates/evidence/er-01-host-check.json",
            "sha256": "19506f29e0435d4e6caf8059f7290c185a9efcbadb588543c877113880ddc57f"
          }
        ]
      },
      "host_checked": {
        "status": "passed",
        "evidence_refs": [
          {
            "path": "spaceclaim-vision-modeling/assets/operation-templates/evidence/er-01-host-check.json",
            "sha256": "19506f29e0435d4e6caf8059f7290c185a9efcbadb588543c877113880ddc57f"
          }
        ]
      },
      "spaceclaim_execution": {
        "status": "not_tested",
        "evidence_refs": []
      },
      "geometry_measurements": {
        "status": "not_tested",
        "evidence_refs": []
      },
      "native_save": {
        "status": "not_tested",
        "evidence_refs": []
      },
      "native_reopen": {
        "status": "not_tested",
        "evidence_refs": []
      },
      "visual_review": {
        "status": "not_tested",
        "evidence_refs": []
      },
      "requested_export": {
        "status": "not_tested",
        "evidence_refs": []
      }
    },
    "notes": "Guidance interface checked on host; synthetic independent application reviewed. No controller event or repaired geometry was observed for this guide."
  },
  "artifact_links": [
    {
      "path": "spaceclaim-vision-modeling/references/atomic-guidance/er-01.json",
      "sha256": "701f9405c793ace9e51ff770b7cd5d142839bbbbc65c1ae70a9b1043e4818a9f",
      "role": "implementation"
    },
    {
      "path": "spaceclaim-vision-modeling/references/atomic-guidance/er-01.json",
      "sha256": "701f9405c793ace9e51ff770b7cd5d142839bbbbc65c1ae70a9b1043e4818a9f",
      "role": "reference"
    },
    {
      "path": "tests/test_execution_guidance.py",
      "sha256": "f3918ac4379f5488144fab920f60d121aa4e5863ef91808bb4ae04b469601e53",
      "role": "test"
    },
    {
      "path": "spaceclaim-vision-modeling/assets/operation-templates/evidence/er-01-host-check.json",
      "sha256": "19506f29e0435d4e6caf8059f7290c185a9efcbadb588543c877113880ddc57f",
      "role": "evidence"
    },
    {
      "path": "spaceclaim-vision-modeling/assets/evaluations/p4-actions/raw-inputs.json",
      "sha256": "aabef50fb9f00315ad2bf3eee4bbb482f9be24552e26b944db850b135fa6ce9d",
      "role": "evidence"
    },
    {
      "path": "spaceclaim-vision-modeling/assets/evaluations/p4-actions/results.json",
      "sha256": "2bbacd139150806264d43f6bdf509562694c5c234bb5c1acb6861cbe4e706cc4",
      "role": "evidence"
    },
    {
      "path": "spaceclaim-vision-modeling/assets/evaluations/p4-actions/evaluation.md",
      "sha256": "e6db426ca8e019a47c4bec7d7e0f9394db4ddbcd130e9c9119de8cc9061930a0",
      "role": "evidence"
    },
    {
      "path": "spaceclaim-vision-modeling/assets/evaluations/p4-actions/delta-results.json",
      "sha256": "c62b76c542c9e655f7c02cd28fbaa875d652b1db1e8ed4738cfaa7a434122fb4",
      "role": "evidence"
    },
    {
      "path": "spaceclaim-vision-modeling/assets/evaluations/p4-actions/delta-evaluation.md",
      "sha256": "717cec638cce5f62e80a697721b1e364a912dda9f5bc42eafc76e8e71ee52ee8",
      "role": "evidence"
    }
  ]
}
