{
  "operation_id": "modeling_strategy_scripting.declare-operation-dependency",
  "template_version": "0.3.1",
  "contract_version": 1,
  "status": "candidate",
  "stage": "modeling_strategy_scripting",
  "purpose": "操作依赖边",
  "trigger": "声明一个操作依赖 when its declared inputs are available.",
  "inputs": [
    {
      "name": "upstream_operation",
      "type": "object",
      "description": "Object with required keys `operation_id` and `outputs`; operation_id identifies one upstream instance.",
      "required": true,
      "provenance_required": true
    },
    {
      "name": "downstream_operation",
      "type": "object",
      "description": "Object with required keys `operation_id` and `inputs`; operation_id identifies one downstream instance.",
      "required": true,
      "provenance_required": true
    },
    {
      "name": "required_artifact_or_state",
      "type": "object",
      "description": "Object with required keys `name`, `kind`, and `reason` for the one artifact or state that must flow.",
      "required": true,
      "provenance_required": true
    },
    {
      "name": "existing_dependency_edges",
      "type": "array",
      "description": "Array of edge objects, each with required keys `upstream_id`, `downstream_id`, and `artifact_or_state`, used only for duplicate and cycle checks.",
      "required": true,
      "provenance_required": true
    }
  ],
  "preconditions": [
    "两个实例身份明确且依赖有数据或状态理由",
    "Use only this single-action procedure; source or upstream instance references must be supplied."
  ],
  "outputs": [
    {
      "name": "result",
      "type": "atomic-reasoning-output",
      "required": true,
      "description": "One 操作依赖边 in the common envelope; data fields: dependency_edge."
    }
  ],
  "output_schema": {
    "path": "spaceclaim-vision-modeling/references/atomic-reasoning-output.schema.json",
    "sha256": "bf85e0ce52172812c387b32e8b3f374cf9d637802d0d9706bc29baf4408b404f"
  },
  "host_checker": {
    "path": "spaceclaim-vision-modeling/scripts/validate_atomic_reasoning.py",
    "sha256": "214bb860c82ab19f3a04db89d09696db90c9fc104ab9afa095c24da8c4aa824c"
  },
  "postconditions": [
    "边指向实际前置条件；不引入循环或凭空限制顺序",
    "The typed result and provenance agree with the declared single-action scope; unsupported required fields withhold a resolved result."
  ],
  "implementation": {
    "mode": "reasoning_guidance",
    "primary_artifact": null,
    "target_environment": "Source interpretation or strategy reasoning; no SpaceClaim runtime.",
    "topology_effect": "none",
    "determinism": "bounded_heuristic",
    "notes": "No standalone deterministic interpreter is claimed. Apply only MS-04 in the hash-bound guidance reference using atomic-reasoning-protocol.md."
  },
  "semantic_selection": {
    "required": false,
    "criteria": [],
    "ambiguity_checks": [
      "Reject an edge justified only by visual order, stage labels, or convenience rather than a required artifact or state.",
      "Reject self-edges, cycles, duplicate edges, and operation identities that are not explicit.",
      "Do not turn a dependency edge into a complete recipe or hidden operation sequence."
    ],
    "topology_refresh": "No geometry handles are acquired; declarations do not mutate or refresh application topology."
  },
  "failure_modes": [
    {
      "failure_id": "insufficient_or_conflicting_input",
      "condition": "The declared action inputs cannot support a unique required result.",
      "detection": "Apply the action rejection rules and inspect raw source evidence.",
      "safe_state": "Return actionable unresolved fields; retain original evidence and values."
    }
  ],
  "recovery": [
    {
      "failure_id": "insufficient_or_conflicting_input",
      "action": "Supply only the missing source or prerequisite, then repeat this action; do not invent geometry or start application execution.",
      "clean_rerun_required": false
    }
  ],
  "validation": [
    {
      "check": "One action boundary",
      "method": "Inspect named inputs, result fields, procedure and rejection rules for MS-04",
      "expected": "操作依赖边",
      "evidence_layer": "design_only"
    },
    {
      "check": "Result structure and supported invariants",
      "method": "validate_atomic_reasoning.py with an actual source manifest; separately review interpretation against raw material.",
      "expected": "边指向实际前置条件；不引入循环或凭空限制顺序",
      "evidence_layer": "host_checked"
    }
  ],
  "dependencies": [],
  "evidence_level": {
    "template_version": "0.3.1",
    "layers": {
      "design_only": {
        "status": "passed",
        "evidence_refs": [
          {
            "path": "spaceclaim-vision-modeling/assets/operation-templates/design-evidence/ms-04-design.json",
            "sha256": "37978668174e25c858d794a856f1b4a9a3480137b5d506f600f2fa0a527b15bc"
          }
        ]
      },
      "host_checked": {
        "status": "passed",
        "evidence_refs": [
          {
            "path": "spaceclaim-vision-modeling/assets/operation-templates/evidence/ms-04-host-check.json",
            "sha256": "9640e2c8b7b94f13fbb8bf6680293c03451559fbb99d58a7e63dcbd082843a21"
          }
        ],
        "notes": "Host structure/invariants and bounded independent source evaluation; no automatic promotion."
      },
      "spaceclaim_execution": {
        "status": "not_applicable",
        "evidence_refs": []
      },
      "geometry_measurements": {
        "status": "not_applicable",
        "evidence_refs": []
      },
      "native_save": {
        "status": "not_applicable",
        "evidence_refs": []
      },
      "native_reopen": {
        "status": "not_applicable",
        "evidence_refs": []
      },
      "visual_review": {
        "status": "not_applicable",
        "evidence_refs": []
      },
      "requested_export": {
        "status": "not_applicable",
        "evidence_refs": []
      }
    },
    "notes": "Candidate. Structural tests cannot establish source interpretation accuracy or any SpaceClaim runtime capability."
  },
  "artifact_links": [
    {
      "path": "spaceclaim-vision-modeling/references/atomic-guidance/ms-04.json",
      "role": "reference",
      "sha256": "5f48fe12dbea89301213251c95b1abf92bf706e0448a596bf14e9b2ec20fc2f2"
    },
    {
      "path": "spaceclaim-vision-modeling/references/atomic-reasoning-protocol.md",
      "role": "reference"
    },
    {
      "path": "spaceclaim-vision-modeling/references/atomic-reasoning-output.schema.json",
      "role": "reference",
      "sha256": "bf85e0ce52172812c387b32e8b3f374cf9d637802d0d9706bc29baf4408b404f"
    },
    {
      "path": "spaceclaim-vision-modeling/scripts/validate_atomic_reasoning.py",
      "role": "evaluation",
      "sha256": "214bb860c82ab19f3a04db89d09696db90c9fc104ab9afa095c24da8c4aa824c"
    },
    {
      "path": "spaceclaim-vision-modeling/assets/operation-templates/design-evidence/ms-04-design.json",
      "role": "evidence",
      "sha256": "37978668174e25c858d794a856f1b4a9a3480137b5d506f600f2fa0a527b15bc"
    },
    {
      "path": "spaceclaim-vision-modeling/assets/operation-templates/evidence/ms-04-host-check.json",
      "role": "evidence",
      "sha256": "9640e2c8b7b94f13fbb8bf6680293c03451559fbb99d58a7e63dcbd082843a21"
    },
    {
      "path": "tests/test_atomic_reasoning.py",
      "role": "test",
      "sha256": "368a780f4e677ecd000769eb8848b6ee4349292a1ecbe21d4db8446c6e1dcc6c"
    }
  ]
}
