{
  "$schema": "../../../references/operation-template.schema.json",
  "operation_id": "execution_recovery.repair-open-or-invalid-geometry",
  "template_version": "0.1.0",
  "contract_version": 1,
  "status": "candidate",
  "stage": "execution_recovery",
  "purpose": "Produce one localized repair action for one identified open/invalid defect without changing confirmed dimensions.",
  "trigger": "Use when one defect and one approved repair mode are known; not a generic repair search.",
  "inputs": [
    {
      "name": "located_defect",
      "type": "object",
      "description": "One open edge, invalid face, nonmanifold junction, or localized defect identity.",
      "required": true
    },
    {
      "name": "selected_repair_method",
      "type": "object",
      "description": "One preselected target-version repair mode and known call/signature if available.",
      "required": true
    },
    {
      "name": "allowable_scope",
      "type": "object",
      "description": "Faces/edges/body region and dimensions that may not change.",
      "required": true
    }
  ],
  "preconditions": [
    "Exactly one defect is located and edit region is bounded.",
    "One known target-version mode is selected; automatic mode search is forbidden."
  ],
  "outputs": [
    {
      "name": "single_defect_repair",
      "type": "object",
      "description": "One mode, target selector, exact call fragment, or needs_manual_review.",
      "required": true
    },
    {
      "name": "resulting_condition",
      "type": "object",
      "description": "One closure/validity condition to check afterward.",
      "required": true
    },
    {
      "name": "preservation_checks",
      "type": "array",
      "description": "Dimensions/topology constraints that must remain unchanged.",
      "required": true
    },
    {
      "name": "needs_manual_review",
      "type": "boolean",
      "description": "True when defect/mode/API is unknown.",
      "required": true
    }
  ],
  "postconditions": [
    "One repair action is emitted for one defect with one post-repair condition.",
    "The emitted repair constrains outside-scope dimensions; actual preservation remains untested until execution and measurement."
  ],
  "implementation": {
    "mode": "reasoning_guidance",
    "primary_artifact": "spaceclaim-vision-modeling/references/atomic-guidance/er-07.json",
    "target_environment": "SpaceClaim V21-compatible contract reasoning; no host execution is performed by this operation.",
    "topology_effect": "none",
    "determinism": "bounded_heuristic",
    "notes": "The reusable artifact is this candidate guidance contract; no executable implementation is claimed. Unknown mode/API remains needs_manual_review; no generic repairer is claimed."
  },
  "semantic_selection": {
    "required": true,
    "criteria": [
      "topology",
      "geometry_type",
      "adjacency"
    ],
    "ambiguity_checks": [
      "Use only the declared identity, state, or geometry predicates; do not substitute recorded FaceN/BodyN aliases or an arbitrary collection member.",
      "If the declared evidence cannot make the target unique, return needs_manual_review and do not continue."
    ],
    "topology_refresh": "Re-enumerate affected topology after repair before downstream selection."
  },
  "failure_modes": [
    {
      "failure_id": "repair_mode_unknown",
      "condition": "Local repair mode or target-version call is unverified.",
      "detection": "Mode/signature missing or conflicts with target API.",
      "safe_state": "No repair is emitted/executed."
    },
    {
      "failure_id": "repair_scope_widened",
      "condition": "Edit touches beyond allowable local defect.",
      "detection": "Selector includes extra faces/edges/body regions.",
      "safe_state": "Discard widened repair."
    }
  ],
  "recovery": [
    {
      "failure_id": "repair_mode_unknown",
      "action": "Return needs_manual_review and obtain version-specific method.",
      "clean_rerun_required": false
    },
    {
      "failure_id": "repair_scope_widened",
      "action": "Reduce to one defect or stop for review.",
      "clean_rerun_required": true
    }
  ],
  "validation": [
    {
      "check": "Candidate identity and schema shape",
      "method": "Validate this object against operation-template.schema.json and compare operation_id with the EX/ER catalog slug.",
      "expected": "The object is schema-valid, remains candidate, and declares exactly one bounded execution_recovery action.",
      "evidence_layer": "design_only"
    },
    {
      "check": "Guidance binding and refusal boundary",
      "method": "Read the linked single-operation guidance and compare its input, result, procedure, and rejection fields with this contract.",
      "expected": "The contract exposes every declared input/output and preserves refusal, recovery, and needs_manual_review behavior.",
      "evidence_layer": "design_only"
    },
    {
      "check": "Action-specific postcondition",
      "method": "Use the operation-specific controller or host-tool adapter only after the required authorization and target-state gates are independently satisfied.",
      "expected": "One repair action is emitted for one defect with one post-repair condition.",
      "evidence_layer": "design_only"
    }
  ],
  "dependencies": [
    "execution_recovery.capture-earliest-failure-state"
  ],
  "evidence_level": {
    "template_version": "0.1.0",
    "layers": {
      "design_only": {
        "status": "passed",
        "evidence_refs": [
          {
            "path": "spaceclaim-vision-modeling/assets/operation-templates/evidence/er-07-host-check.json",
            "sha256": "f2a685bec8fdf9722c4241854cfc6121e4f0400516705ebbae55f173270da526"
          }
        ]
      },
      "host_checked": {
        "status": "passed",
        "evidence_refs": [
          {
            "path": "spaceclaim-vision-modeling/assets/operation-templates/evidence/er-07-host-check.json",
            "sha256": "f2a685bec8fdf9722c4241854cfc6121e4f0400516705ebbae55f173270da526"
          }
        ]
      },
      "spaceclaim_execution": {
        "status": "not_tested",
        "evidence_refs": []
      },
      "geometry_measurements": {
        "status": "not_tested",
        "evidence_refs": []
      },
      "native_save": {
        "status": "not_tested",
        "evidence_refs": []
      },
      "native_reopen": {
        "status": "not_tested",
        "evidence_refs": []
      },
      "visual_review": {
        "status": "not_tested",
        "evidence_refs": []
      },
      "requested_export": {
        "status": "not_tested",
        "evidence_refs": []
      }
    },
    "notes": "Guidance interface checked on host; synthetic independent application reviewed. No controller event or repaired geometry was observed for this guide."
  },
  "artifact_links": [
    {
      "path": "spaceclaim-vision-modeling/references/atomic-guidance/er-07.json",
      "sha256": "0031dfb7e87cf02b76c83d3dc9ca84e92c10c43fd1f56b560ce2d1146861568f",
      "role": "implementation"
    },
    {
      "path": "spaceclaim-vision-modeling/references/atomic-guidance/er-07.json",
      "sha256": "0031dfb7e87cf02b76c83d3dc9ca84e92c10c43fd1f56b560ce2d1146861568f",
      "role": "reference"
    },
    {
      "path": "tests/test_execution_guidance.py",
      "sha256": "f3918ac4379f5488144fab920f60d121aa4e5863ef91808bb4ae04b469601e53",
      "role": "test"
    },
    {
      "path": "spaceclaim-vision-modeling/assets/operation-templates/evidence/er-07-host-check.json",
      "sha256": "f2a685bec8fdf9722c4241854cfc6121e4f0400516705ebbae55f173270da526",
      "role": "evidence"
    },
    {
      "path": "spaceclaim-vision-modeling/assets/evaluations/p4-actions/raw-inputs.json",
      "sha256": "aabef50fb9f00315ad2bf3eee4bbb482f9be24552e26b944db850b135fa6ce9d",
      "role": "evidence"
    },
    {
      "path": "spaceclaim-vision-modeling/assets/evaluations/p4-actions/results.json",
      "sha256": "2bbacd139150806264d43f6bdf509562694c5c234bb5c1acb6861cbe4e706cc4",
      "role": "evidence"
    },
    {
      "path": "spaceclaim-vision-modeling/assets/evaluations/p4-actions/evaluation.md",
      "sha256": "e6db426ca8e019a47c4bec7d7e0f9394db4ddbcd130e9c9119de8cc9061930a0",
      "role": "evidence"
    },
    {
      "path": "spaceclaim-vision-modeling/assets/evaluations/p4-actions/delta-results.json",
      "sha256": "c62b76c542c9e655f7c02cd28fbaa875d652b1db1e8ed4738cfaa7a434122fb4",
      "role": "evidence"
    },
    {
      "path": "spaceclaim-vision-modeling/assets/evaluations/p4-actions/delta-evaluation.md",
      "sha256": "717cec638cce5f62e80a697721b1e364a912dda9f5bc42eafc76e8e71ee52ee8",
      "role": "evidence"
    }
  ]
}
