{
  "operation_id": "modeling_strategy_scripting.declare-parameter",
  "template_version": "0.3.1",
  "contract_version": 1,
  "status": "candidate",
  "stage": "modeling_strategy_scripting",
  "purpose": "参数声明",
  "trigger": "声明一个参数 when its declared inputs are available.",
  "inputs": [
    {
      "name": "parameter_name",
      "type": "string",
      "description": "The case-neutral name for one parameter.",
      "required": true,
      "provenance_required": true
    },
    {
      "name": "source_dimension",
      "type": "object",
      "description": "Object with required keys `value`, `unit`, `provenance`, and `source_ref`; value is one supplied parameter value and provenance identifies its source kind.",
      "required": true,
      "provenance_required": true
    },
    {
      "name": "unit_and_allowed_range",
      "type": "object",
      "description": "Object with required key `unit`; optional keys `lower`, `upper`, and `allowed_values` declare one range without evaluating whether the value satisfies it.",
      "required": true,
      "provenance_required": true
    },
    {
      "name": "existing_parameter_names",
      "type": "array",
      "description": "Names already declared in the same build contract, used only for conflict detection.",
      "required": true,
      "provenance_required": true
    }
  ],
  "preconditions": [
    "名称未与其他语义冲突",
    "Use only this single-action procedure; source or upstream instance references must be supplied."
  ],
  "outputs": [
    {
      "name": "result",
      "type": "atomic-reasoning-output",
      "required": true,
      "description": "One 参数声明 in the common envelope; data fields: parameter_declaration."
    }
  ],
  "output_schema": {
    "path": "spaceclaim-vision-modeling/references/atomic-reasoning-output.schema.json",
    "sha256": "bf85e0ce52172812c387b32e8b3f374cf9d637802d0d9706bc29baf4408b404f"
  },
  "host_checker": {
    "path": "spaceclaim-vision-modeling/scripts/validate_atomic_reasoning.py",
    "sha256": "214bb860c82ab19f3a04db89d09696db90c9fc104ab9afa095c24da8c4aa824c"
  },
  "postconditions": [
    "值、单位、范围和来源一致且可被脚本引用",
    "The typed result and provenance agree with the declared single-action scope; unsupported required fields withhold a resolved result."
  ],
  "implementation": {
    "mode": "reasoning_guidance",
    "primary_artifact": null,
    "target_environment": "Source interpretation or strategy reasoning; no SpaceClaim runtime.",
    "topology_effect": "none",
    "determinism": "bounded_heuristic",
    "notes": "No standalone deterministic interpreter is claimed. Apply only MS-01 in the hash-bound guidance reference using atomic-reasoning-protocol.md."
  },
  "semantic_selection": {
    "required": false,
    "criteria": [],
    "ambiguity_checks": [
      "Reject a missing, ambiguous, or conflicting parameter name.",
      "Reject a value with unknown dimensionality, incompatible units, or a malformed range representation; do not infer a value or decide whether it satisfies the range.",
      "Do not bundle multiple parameters or a construction recipe into one declaration."
    ],
    "topology_refresh": "No geometry handles are acquired; declarations do not mutate or refresh application topology."
  },
  "failure_modes": [
    {
      "failure_id": "insufficient_or_conflicting_input",
      "condition": "The declared action inputs cannot support a unique required result.",
      "detection": "Apply the action rejection rules and inspect raw source evidence.",
      "safe_state": "Return actionable unresolved fields; retain original evidence and values."
    }
  ],
  "recovery": [
    {
      "failure_id": "insufficient_or_conflicting_input",
      "action": "Supply only the missing source or prerequisite, then repeat this action; do not invent geometry or start application execution.",
      "clean_rerun_required": false
    }
  ],
  "validation": [
    {
      "check": "One action boundary",
      "method": "Inspect named inputs, result fields, procedure and rejection rules for MS-01",
      "expected": "参数声明",
      "evidence_layer": "design_only"
    },
    {
      "check": "Result structure and supported invariants",
      "method": "validate_atomic_reasoning.py with an actual source manifest; separately review interpretation against raw material.",
      "expected": "值、单位、范围和来源一致且可被脚本引用",
      "evidence_layer": "host_checked"
    }
  ],
  "dependencies": [],
  "evidence_level": {
    "template_version": "0.3.1",
    "layers": {
      "design_only": {
        "status": "passed",
        "evidence_refs": [
          {
            "path": "spaceclaim-vision-modeling/assets/operation-templates/design-evidence/ms-01-design.json",
            "sha256": "150aac4863a972285dcc38f5188acfbd01a51eaddca27f54f3e9667c639a3221"
          }
        ]
      },
      "host_checked": {
        "status": "passed",
        "evidence_refs": [
          {
            "path": "spaceclaim-vision-modeling/assets/operation-templates/evidence/ms-01-host-check.json",
            "sha256": "76244da2ec6802227425f7b0b940e3ea6e369a1c8d93fa222652d6a29c0df4cb"
          }
        ],
        "notes": "Host structure/invariants and bounded independent source evaluation; no automatic promotion."
      },
      "spaceclaim_execution": {
        "status": "not_applicable",
        "evidence_refs": []
      },
      "geometry_measurements": {
        "status": "not_applicable",
        "evidence_refs": []
      },
      "native_save": {
        "status": "not_applicable",
        "evidence_refs": []
      },
      "native_reopen": {
        "status": "not_applicable",
        "evidence_refs": []
      },
      "visual_review": {
        "status": "not_applicable",
        "evidence_refs": []
      },
      "requested_export": {
        "status": "not_applicable",
        "evidence_refs": []
      }
    },
    "notes": "Candidate. Structural tests cannot establish source interpretation accuracy or any SpaceClaim runtime capability."
  },
  "artifact_links": [
    {
      "path": "spaceclaim-vision-modeling/references/atomic-guidance/ms-01.json",
      "role": "reference",
      "sha256": "7fc631daece23ce9a2d120a0f37226b42c13d89c74984f54c16625ffeeea8e9a"
    },
    {
      "path": "spaceclaim-vision-modeling/references/atomic-reasoning-protocol.md",
      "role": "reference"
    },
    {
      "path": "spaceclaim-vision-modeling/references/atomic-reasoning-output.schema.json",
      "role": "reference",
      "sha256": "bf85e0ce52172812c387b32e8b3f374cf9d637802d0d9706bc29baf4408b404f"
    },
    {
      "path": "spaceclaim-vision-modeling/scripts/validate_atomic_reasoning.py",
      "role": "evaluation",
      "sha256": "214bb860c82ab19f3a04db89d09696db90c9fc104ab9afa095c24da8c4aa824c"
    },
    {
      "path": "spaceclaim-vision-modeling/assets/operation-templates/design-evidence/ms-01-design.json",
      "role": "evidence",
      "sha256": "150aac4863a972285dcc38f5188acfbd01a51eaddca27f54f3e9667c639a3221"
    },
    {
      "path": "spaceclaim-vision-modeling/assets/operation-templates/evidence/ms-01-host-check.json",
      "role": "evidence",
      "sha256": "76244da2ec6802227425f7b0b940e3ea6e369a1c8d93fa222652d6a29c0df4cb"
    },
    {
      "path": "tests/test_atomic_reasoning.py",
      "role": "test",
      "sha256": "368a780f4e677ecd000769eb8848b6ee4349292a1ecbe21d4db8446c6e1dcc6c"
    }
  ]
}
