{
  "$schema": "../../../references/operation-template.schema.json",
  "operation_id": "execution_recovery.execute-loaded-scscript-once",
  "template_version": "0.1.0",
  "contract_version": 1,
  "status": "candidate",
  "stage": "execution_recovery",
  "purpose": "Issue exactly one execution command for the already loaded, hash-identified script in the matching design.",
  "trigger": "Use only after authorization, session, document, and loaded-script gates are satisfied.",
  "inputs": [
    {
      "name": "loaded_script_identity",
      "type": "object",
      "description": "Exact loaded script identity, hash, session, and document binding.",
      "required": true
    },
    {
      "name": "current_design_identity",
      "type": "object",
      "description": "Active design identity and clean/baseline-copy entry state.",
      "required": true
    }
  ],
  "preconditions": [
    "Loaded script and current design identities match the accepted run.",
    "Target session is authorized, idle, and free of a blocking dialog."
  ],
  "outputs": [
    {
      "name": "execution_event",
      "type": "object",
      "description": "One run identifier, launch time, script hash, session/document identity, and command observation.",
      "required": true
    },
    {
      "name": "launch_status",
      "type": "string",
      "description": "One of launched, rejected, or needs_manual_review; not a completion result.",
      "required": true
    }
  ],
  "postconditions": [
    "Exactly one execution event is observed and correlated with the loaded artifact.",
    "No success, failure, save, or geometry measurement is inferred from launch alone."
  ],
  "implementation": {
    "mode": "computer_use",
    "primary_artifact": "spaceclaim-vision-modeling/references/atomic-guidance/ex-09.json",
    "target_environment": "Authorized SpaceClaim V21 desktop session with the target window kept maximized unless a recorded layout exception applies.",
    "topology_effect": "none",
    "determinism": "interactive",
    "notes": "The controller performs one bounded GUI action or observation; it must not expand this contract into a workflow. Starts one run only; waiting and terminal classification belong to EX-10."
  },
  "semantic_selection": {
    "required": false,
    "criteria": [],
    "ambiguity_checks": [
      "Use only the declared identity, state, or geometry predicates; do not substitute recorded FaceN/BodyN aliases or an arbitrary collection member.",
      "If the declared evidence cannot make the target unique, return needs_manual_review and do not continue."
    ],
    "topology_refresh": "Not applicable; the operation does not mutate model topology."
  },
  "failure_modes": [
    {
      "failure_id": "launch_precondition_failed",
      "condition": "An identity, authorization, or idle gate is false.",
      "detection": "A gate fails immediately before Run.",
      "safe_state": "No new run is started."
    },
    {
      "failure_id": "launch_event_uncertain",
      "condition": "It is unclear whether one execution command was accepted.",
      "detection": "UI response or run ID cannot be correlated.",
      "safe_state": "Do not issue another Run command."
    }
  ],
  "recovery": [
    {
      "failure_id": "launch_precondition_failed",
      "action": "Correct exactly the failed gate and return to a clean loaded-script state.",
      "clean_rerun_required": true
    },
    {
      "failure_id": "launch_event_uncertain",
      "action": "Preserve the observation and return needs_manual_review.",
      "clean_rerun_required": false
    }
  ],
  "validation": [
    {
      "check": "Candidate identity and schema shape",
      "method": "Validate this object against operation-template.schema.json and compare operation_id with the EX/ER catalog slug.",
      "expected": "The object is schema-valid, remains candidate, and declares exactly one bounded execution_recovery action.",
      "evidence_layer": "design_only"
    },
    {
      "check": "Guidance binding and refusal boundary",
      "method": "Read the linked single-operation guidance and compare its input, result, procedure, and rejection fields with this contract.",
      "expected": "The contract exposes every declared input/output and preserves refusal, recovery, and needs_manual_review behavior.",
      "evidence_layer": "design_only"
    },
    {
      "check": "Action-specific postcondition",
      "method": "Use the operation-specific controller or host-tool adapter only after the required authorization and target-state gates are independently satisfied.",
      "expected": "Exactly one execution event is observed and correlated with the loaded artifact.",
      "evidence_layer": "spaceclaim_execution"
    }
  ],
  "dependencies": [
    "execution_recovery.load-scscript",
    "execution_recovery.verify-active-document"
  ],
  "evidence_level": {
    "template_version": "0.1.0",
    "layers": {
      "design_only": {
        "status": "passed",
        "evidence_refs": [
          {
            "path": "spaceclaim-vision-modeling/assets/operation-templates/evidence/ex-09-host-check.json",
            "sha256": "50f84beab0f0144d86e3c0e3fa5afe9dfc972c6c94d30111f8b7dc547ae22861"
          }
        ]
      },
      "host_checked": {
        "status": "passed",
        "evidence_refs": [
          {
            "path": "spaceclaim-vision-modeling/assets/operation-templates/evidence/ex-09-host-check.json",
            "sha256": "50f84beab0f0144d86e3c0e3fa5afe9dfc972c6c94d30111f8b7dc547ae22861"
          }
        ]
      },
      "spaceclaim_execution": {
        "status": "not_tested",
        "evidence_refs": []
      },
      "geometry_measurements": {
        "status": "not_tested",
        "evidence_refs": []
      },
      "native_save": {
        "status": "not_tested",
        "evidence_refs": []
      },
      "native_reopen": {
        "status": "not_tested",
        "evidence_refs": []
      },
      "visual_review": {
        "status": "not_tested",
        "evidence_refs": []
      },
      "requested_export": {
        "status": "not_tested",
        "evidence_refs": []
      }
    },
    "notes": "Guidance interface checked on host; synthetic independent application reviewed. No controller event or repaired geometry was observed for this guide."
  },
  "artifact_links": [
    {
      "path": "spaceclaim-vision-modeling/references/atomic-guidance/ex-09.json",
      "sha256": "edc31f833e169713ef87c36f6f3796c90172f4092c4f59a1263b0c62658ebca8",
      "role": "implementation"
    },
    {
      "path": "spaceclaim-vision-modeling/references/atomic-guidance/ex-09.json",
      "sha256": "edc31f833e169713ef87c36f6f3796c90172f4092c4f59a1263b0c62658ebca8",
      "role": "reference"
    },
    {
      "path": "tests/test_execution_guidance.py",
      "sha256": "f3918ac4379f5488144fab920f60d121aa4e5863ef91808bb4ae04b469601e53",
      "role": "test"
    },
    {
      "path": "spaceclaim-vision-modeling/assets/operation-templates/evidence/ex-09-host-check.json",
      "sha256": "50f84beab0f0144d86e3c0e3fa5afe9dfc972c6c94d30111f8b7dc547ae22861",
      "role": "evidence"
    },
    {
      "path": "spaceclaim-vision-modeling/assets/evaluations/p4-actions/raw-inputs.json",
      "sha256": "aabef50fb9f00315ad2bf3eee4bbb482f9be24552e26b944db850b135fa6ce9d",
      "role": "evidence"
    },
    {
      "path": "spaceclaim-vision-modeling/assets/evaluations/p4-actions/results.json",
      "sha256": "2bbacd139150806264d43f6bdf509562694c5c234bb5c1acb6861cbe4e706cc4",
      "role": "evidence"
    },
    {
      "path": "spaceclaim-vision-modeling/assets/evaluations/p4-actions/evaluation.md",
      "sha256": "e6db426ca8e019a47c4bec7d7e0f9394db4ddbcd130e9c9119de8cc9061930a0",
      "role": "evidence"
    },
    {
      "path": "spaceclaim-vision-modeling/assets/evaluations/p4-actions/delta-results.json",
      "sha256": "c62b76c542c9e655f7c02cd28fbaa875d652b1db1e8ed4738cfaa7a434122fb4",
      "role": "evidence"
    },
    {
      "path": "spaceclaim-vision-modeling/assets/evaluations/p4-actions/delta-evaluation.md",
      "sha256": "717cec638cce5f62e80a697721b1e364a912dda9f5bc42eafc76e8e71ee52ee8",
      "role": "evidence"
    }
  ]
}
